Sheet: Sheet1
A1: EquityReturn | B1: 0
A2: Annual Contribution | B2: 1000
A3: Increase In contribution | B3: 0
A5: Savings at 67 | B5: of:=[.H53] -> 45000
A8: CalendarYear | B8: Age | C8: NumberOfYears | D8: PriorYear | E8: AnnualContribution | F8: StartOfYear | G8: InvestmentReturn | H8: EndOfYear
A9: 2024 | B9: 50 | C9: 0 | D9: 0 | E9: of:=[.B2] -> 1000 | F9: of:=[.E9]+[.D9] -> 1000 | G9: of:=[.F9]*[.$B$1] -> 0 | H9: of:=[.G9]+[.F9] -> 1000
A10: of:=[.A9]+1 -> 2025 | B10: of:=[.B9]+1 -> 51 | C10: of:=[.C9]+1 -> 1 | D10: of:=[.H9] -> 1000 | E10: of:=[.E9]*(1+[.$B$3]) -> 1000 | F10: of:=[.E10]+[.D10] -> 2000 | G10: of:=[.F10]*[.$B$1] -> 0 | H10: of:=[.G10]+[.F10] -> 2000
A11: of:=[.A10]+1 -> 2026 | B11: of:=[.B10]+1 -> 52 | C11: of:=[.C10]+1 -> 2 | D11: of:=[.H10] -> 2000 | E11: of:=[.E10]*(1+[.$B$3]) -> 1000 | F11: of:=[.E11]+[.D11] -> 3000 | G11: of:=[.F11]*[.$B$1] -> 0 | H11: of:=[.G11]+[.F11] -> 3000
A12: of:=[.A11]+1 -> 2027 | B12: of:=[.B11]+1 -> 53 | C12: of:=[.C11]+1 -> 3 | D12: of:=[.H11] -> 3000 | E12: of:=[.E11]*(1+[.$B$3]) -> 1000 | F12: of:=[.E12]+[.D12] -> 4000 | G12: of:=[.F12]*[.$B$1] -> 0 | H12: of:=[.G12]+[.F12] -> 4000
A13: of:=[.A12]+1 -> 2028 | B13: of:=[.B12]+1 -> 54 | C13: of:=[.C12]+1 -> 4 | D13: of:=[.H12] -> 4000 | E13: of:=[.E12]*(1+[.$B$3]) -> 1000 | F13: of:=[.E13]+[.D13] -> 5000 | G13: of:=[.F13]*[.$B$1] -> 0 | H13: of:=[.G13]+[.F13] -> 5000
A14: of:=[.A13]+1 -> 2029 | B14: of:=[.B13]+1 -> 55 | C14: of:=[.C13]+1 -> 5 | D14: of:=[.H13] -> 5000 | E14: of:=[.E13]*(1+[.$B$3]) -> 1000 | F14: of:=[.E14]+[.D14] -> 6000 | G14: of:=[.F14]*[.$B$1] -> 0 | H14: of:=[.G14]+[.F14] -> 6000
A15: of:=[.A14]+1 -> 2030 | B15: of:=[.B14]+1 -> 56 | C15: of:=[.C14]+1 -> 6 | D15: of:=[.H14] -> 6000 | E15: of:=[.E14]*(1+[.$B$3]) -> 1000 | F15: of:=[.E15]+[.D15] -> 7000 | G15: of:=[.F15]*[.$B$1] -> 0 | H15: of:=[.G15]+[.F15] -> 7000
A16: of:=[.A15]+1 -> 2031 | B16: of:=[.B15]+1 -> 57 | C16: of:=[.C15]+1 -> 7 | D16: of:=[.H15] -> 7000 | E16: of:=[.E15]*(1+[.$B$3]) -> 1000 | F16: of:=[.E16]+[.D16] -> 8000 | G16: of:=[.F16]*[.$B$1] -> 0 | H16: of:=[.G16]+[.F16] -> 8000
A17: of:=[.A16]+1 -> 2032 | B17: of:=[.B16]+1 -> 58 | C17: of:=[.C16]+1 -> 8 | D17: of:=[.H16] -> 8000 | E17: of:=[.E16]*(1+[.$B$3]) -> 1000 | F17: of:=[.E17]+[.D17] -> 9000 | G17: of:=[.F17]*[.$B$1] -> 0 | H17: of:=[.G17]+[.F17] -> 9000
A18: of:=[.A17]+1 -> 2033 | B18: of:=[.B17]+1 -> 59 | C18: of:=[.C17]+1 -> 9 | D18: of:=[.H17] -> 9000 | E18: of:=[.E17]*(1+[.$B$3]) -> 1000 | F18: of:=[.E18]+[.D18] -> 10000 | G18: of:=[.F18]*[.$B$1] -> 0 | H18: of:=[.G18]+[.F18] -> 10000
A19: of:=[.A18]+1 -> 2034 | B19: of:=[.B18]+1 -> 60 | C19: of:=[.C18]+1 -> 10 | D19: of:=[.H18] -> 10000 | E19: of:=[.E18]*(1+[.$B$3]) -> 1000 | F19: of:=[.E19]+[.D19] -> 11000 | G19: of:=[.F19]*[.$B$1] -> 0 | H19: of:=[.G19]+[.F19] -> 11000
A20: of:=[.A19]+1 -> 2035 | B20: of:=[.B19]+1 -> 61 | C20: of:=[.C19]+1 -> 11 | D20: of:=[.H19] -> 11000 | E20: of:=[.E19]*(1+[.$B$3]) -> 1000 | F20: of:=[.E20]+[.D20] -> 12000 | G20: of:=[.F20]*[.$B$1] -> 0 | H20: of:=[.G20]+[.F20] -> 12000
A21: of:=[.A20]+1 -> 2036 | B21: of:=[.B20]+1 -> 62 | C21: of:=[.C20]+1 -> 12 | D21: of:=[.H20] -> 12000 | E21: of:=[.E20]*(1+[.$B$3]) -> 1000 | F21: of:=[.E21]+[.D21] -> 13000 | G21: of:=[.F21]*[.$B$1] -> 0 | H21: of:=[.G21]+[.F21] -> 13000
A22: of:=[.A21]+1 -> 2037 | B22: of:=[.B21]+1 -> 63 | C22: of:=[.C21]+1 -> 13 | D22: of:=[.H21] -> 13000 | E22: of:=[.E21]*(1+[.$B$3]) -> 1000 | F22: of:=[.E22]+[.D22] -> 14000 | G22: of:=[.F22]*[.$B$1] -> 0 | H22: of:=[.G22]+[.F22] -> 14000
A23: of:=[.A22]+1 -> 2038 | B23: of:=[.B22]+1 -> 64 | C23: of:=[.C22]+1 -> 14 | D23: of:=[.H22] -> 14000 | E23: of:=[.E22]*(1+[.$B$3]) -> 1000 | F23: of:=[.E23]+[.D23] -> 15000 | G23: of:=[.F23]*[.$B$1] -> 0 | H23: of:=[.G23]+[.F23] -> 15000
A24: of:=[.A23]+1 -> 2039 | B24: of:=[.B23]+1 -> 65 | C24: of:=[.C23]+1 -> 15 | D24: of:=[.H23] -> 15000 | E24: of:=[.E23]*(1+[.$B$3]) -> 1000 | F24: of:=[.E24]+[.D24] -> 16000 | G24: of:=[.F24]*[.$B$1] -> 0 | H24: of:=[.G24]+[.F24] -> 16000
A25: of:=[.A24]+1 -> 2040 | B25: of:=[.B24]+1 -> 66 | C25: of:=[.C24]+1 -> 16 | D25: of:=[.H24] -> 16000 | E25: of:=[.E24]*(1+[.$B$3]) -> 1000 | F25: of:=[.E25]+[.D25] -> 17000 | G25: of:=[.F25]*[.$B$1] -> 0 | H25: of:=[.G25]+[.F25] -> 17000
A26: of:=[.A25]+1 -> 2041 | B26: of:=[.B25]+1 -> 67 | C26: of:=[.C25]+1 -> 17 | D26: of:=[.H25] -> 17000 | E26: of:=[.E25]*(1+[.$B$3]) -> 1000 | F26: of:=[.E26]+[.D26] -> 18000 | G26: of:=[.F26]*[.$B$1] -> 0 | H26: of:=[.G26]+[.F26] -> 18000
A27: of:=[.A26]+1 -> 2042 | B27: of:=[.B26]+1 -> 68 | C27: of:=[.C26]+1 -> 18 | D27: of:=[.H26] -> 18000 | E27: of:=[.E26]*(1+[.$B$3]) -> 1000 | F27: of:=[.E27]+[.D27] -> 19000 | G27: of:=[.F27]*[.$B$1] -> 0 | H27: of:=[.G27]+[.F27] -> 19000
A28: of:=[.A27]+1 -> 2043 | B28: of:=[.B27]+1 -> 69 | C28: of:=[.C27]+1 -> 19 | D28: of:=[.H27] -> 19000 | E28: of:=[.E27]*(1+[.$B$3]) -> 1000 | F28: of:=[.E28]+[.D28] -> 20000 | G28: of:=[.F28]*[.$B$1] -> 0 | H28: of:=[.G28]+[.F28] -> 20000
A29: of:=[.A28]+1 -> 2044 | B29: of:=[.B28]+1 -> 70 | C29: of:=[.C28]+1 -> 20 | D29: of:=[.H28] -> 20000 | E29: of:=[.E28]*(1+[.$B$3]) -> 1000 | F29: of:=[.E29]+[.D29] -> 21000 | G29: of:=[.F29]*[.$B$1] -> 0 | H29: of:=[.G29]+[.F29] -> 21000
A30: of:=[.A29]+1 -> 2045 | B30: of:=[.B29]+1 -> 71 | C30: of:=[.C29]+1 -> 21 | D30: of:=[.H29] -> 21000 | E30: of:=[.E29]*(1+[.$B$3]) -> 1000 | F30: of:=[.E30]+[.D30] -> 22000 | G30: of:=[.F30]*[.$B$1] -> 0 | H30: of:=[.G30]+[.F30] -> 22000
A31: of:=[.A30]+1 -> 2046 | B31: of:=[.B30]+1 -> 72 | C31: of:=[.C30]+1 -> 22 | D31: of:=[.H30] -> 22000 | E31: of:=[.E30]*(1+[.$B$3]) -> 1000 | F31: of:=[.E31]+[.D31] -> 23000 | G31: of:=[.F31]*[.$B$1] -> 0 | H31: of:=[.G31]+[.F31] -> 23000
A32: of:=[.A31]+1 -> 2047 | B32: of:=[.B31]+1 -> 73 | C32: of:=[.C31]+1 -> 23 | D32: of:=[.H31] -> 23000 | E32: of:=[.E31]*(1+[.$B$3]) -> 1000 | F32: of:=[.E32]+[.D32] -> 24000 | G32: of:=[.F32]*[.$B$1] -> 0 | H32: of:=[.G32]+[.F32] -> 24000
A33: of:=[.A32]+1 -> 2048 | B33: of:=[.B32]+1 -> 74 | C33: of:=[.C32]+1 -> 24 | D33: of:=[.H32] -> 24000 | E33: of:=[.E32]*(1+[.$B$3]) -> 1000 | F33: of:=[.E33]+[.D33] -> 25000 | G33: of:=[.F33]*[.$B$1] -> 0 | H33: of:=[.G33]+[.F33] -> 25000
A34: of:=[.A33]+1 -> 2049 | B34: of:=[.B33]+1 -> 75 | C34: of:=[.C33]+1 -> 25 | D34: of:=[.H33] -> 25000 | E34: of:=[.E33]*(1+[.$B$3]) -> 1000 | F34: of:=[.E34]+[.D34] -> 26000 | G34: of:=[.F34]*[.$B$1] -> 0 | H34: of:=[.G34]+[.F34] -> 26000
A35: of:=[.A34]+1 -> 2050 | B35: of:=[.B34]+1 -> 76 | C35: of:=[.C34]+1 -> 26 | D35: of:=[.H34] -> 26000 | E35: of:=[.E34]*(1+[.$B$3]) -> 1000 | F35: of:=[.E35]+[.D35] -> 27000 | G35: of:=[.F35]*[.$B$1] -> 0 | H35: of:=[.G35]+[.F35] -> 27000
A36: of:=[.A35]+1 -> 2051 | B36: of:=[.B35]+1 -> 77 | C36: of:=[.C35]+1 -> 27 | D36: of:=[.H35] -> 27000 | E36: of:=[.E35]*(1+[.$B$3]) -> 1000 | F36: of:=[.E36]+[.D36] -> 28000 | G36: of:=[.F36]*[.$B$1] -> 0 | H36: of:=[.G36]+[.F36] -> 28000
A37: of:=[.A36]+1 -> 2052 | B37: of:=[.B36]+1 -> 78 | C37: of:=[.C36]+1 -> 28 | D37: of:=[.H36] -> 28000 | E37: of:=[.E36]*(1+[.$B$3]) -> 1000 | F37: of:=[.E37]+[.D37] -> 29000 | G37: of:=[.F37]*[.$B$1] -> 0 | H37: of:=[.G37]+[.F37] -> 29000
A38: of:=[.A37]+1 -> 2053 | B38: of:=[.B37]+1 -> 79 | C38: of:=[.C37]+1 -> 29 | D38: of:=[.H37] -> 29000 | E38: of:=[.E37]*(1+[.$B$3]) -> 1000 | F38: of:=[.E38]+[.D38] -> 30000 | G38: of:=[.F38]*[.$B$1] -> 0 | H38: of:=[.G38]+[.F38] -> 30000
A39: of:=[.A38]+1 -> 2054 | B39: of:=[.B38]+1 -> 80 | C39: of:=[.C38]+1 -> 30 | D39: of:=[.H38] -> 30000 | E39: of:=[.E38]*(1+[.$B$3]) -> 1000 | F39: of:=[.E39]+[.D39] -> 31000 | G39: of:=[.F39]*[.$B$1] -> 0 | H39: of:=[.G39]+[.F39] -> 31000
A40: of:=[.A39]+1 -> 2055 | B40: of:=[.B39]+1 -> 81 | C40: of:=[.C39]+1 -> 31 | D40: of:=[.H39] -> 31000 | E40: of:=[.E39]*(1+[.$B$3]) -> 1000 | F40: of:=[.E40]+[.D40] -> 32000 | G40: of:=[.F40]*[.$B$1] -> 0 | H40: of:=[.G40]+[.F40] -> 32000
A41: of:=[.A40]+1 -> 2056 | B41: of:=[.B40]+1 -> 82 | C41: of:=[.C40]+1 -> 32 | D41: of:=[.H40] -> 32000 | E41: of:=[.E40]*(1+[.$B$3]) -> 1000 | F41: of:=[.E41]+[.D41] -> 33000 | G41: of:=[.F41]*[.$B$1] -> 0 | H41: of:=[.G41]+[.F41] -> 33000
A42: of:=[.A41]+1 -> 2057 | B42: of:=[.B41]+1 -> 83 | C42: of:=[.C41]+1 -> 33 | D42: of:=[.H41] -> 33000 | E42: of:=[.E41]*(1+[.$B$3]) -> 1000 | F42: of:=[.E42]+[.D42] -> 34000 | G42: of:=[.F42]*[.$B$1] -> 0 | H42: of:=[.G42]+[.F42] -> 34000
A43: of:=[.A42]+1 -> 2058 | B43: of:=[.B42]+1 -> 84 | C43: of:=[.C42]+1 -> 34 | D43: of:=[.H42] -> 34000 | E43: of:=[.E42]*(1+[.$B$3]) -> 1000 | F43: of:=[.E43]+[.D43] -> 35000 | G43: of:=[.F43]*[.$B$1] -> 0 | H43: of:=[.G43]+[.F43] -> 35000
A44: of:=[.A43]+1 -> 2059 | B44: of:=[.B43]+1 -> 85 | C44: of:=[.C43]+1 -> 35 | D44: of:=[.H43] -> 35000 | E44: of:=[.E43]*(1+[.$B$3]) -> 1000 | F44: of:=[.E44]+[.D44] -> 36000 | G44: of:=[.F44]*[.$B$1] -> 0 | H44: of:=[.G44]+[.F44] -> 36000
A45: of:=[.A44]+1 -> 2060 | B45: of:=[.B44]+1 -> 86 | C45: of:=[.C44]+1 -> 36 | D45: of:=[.H44] -> 36000 | E45: of:=[.E44]*(1+[.$B$3]) -> 1000 | F45: of:=[.E45]+[.D45] -> 37000 | G45: of:=[.F45]*[.$B$1] -> 0 | H45: of:=[.G45]+[.F45] -> 37000
A46: of:=[.A45]+1 -> 2061 | B46: of:=[.B45]+1 -> 87 | C46: of:=[.C45]+1 -> 37 | D46: of:=[.H45] -> 37000 | E46: of:=[.E45]*(1+[.$B$3]) -> 1000 | F46: of:=[.E46]+[.D46] -> 38000 | G46: of:=[.F46]*[.$B$1] -> 0 | H46: of:=[.G46]+[.F46] -> 38000
A47: of:=[.A46]+1 -> 2062 | B47: of:=[.B46]+1 -> 88 | C47: of:=[.C46]+1 -> 38 | D47: of:=[.H46] -> 38000 | E47: of:=[.E46]*(1+[.$B$3]) -> 1000 | F47: of:=[.E47]+[.D47] -> 39000 | G47: of:=[.F47]*[.$B$1] -> 0 | H47: of:=[.G47]+[.F47] -> 39000
A48: of:=[.A47]+1 -> 2063 | B48: of:=[.B47]+1 -> 89 | C48: of:=[.C47]+1 -> 39 | D48: of:=[.H47] -> 39000 | E48: of:=[.E47]*(1+[.$B$3]) -> 1000 | F48: of:=[.E48]+[.D48] -> 40000 | G48: of:=[.F48]*[.$B$1] -> 0 | H48: of:=[.G48]+[.F48] -> 40000
A49: of:=[.A48]+1 -> 2064 | B49: of:=[.B48]+1 -> 90 | C49: of:=[.C48]+1 -> 40 | D49: of:=[.H48] -> 40000 | E49: of:=[.E48]*(1+[.$B$3]) -> 1000 | F49: of:=[.E49]+[.D49] -> 41000 | G49: of:=[.F49]*[.$B$1] -> 0 | H49: of:=[.G49]+[.F49] -> 41000
A50: of:=[.A49]+1 -> 2065 | B50: of:=[.B49]+1 -> 91 | C50: of:=[.C49]+1 -> 41 | D50: of:=[.H49] -> 41000 | E50: of:=[.E49]*(1+[.$B$3]) -> 1000 | F50: of:=[.E50]+[.D50] -> 42000 | G50: of:=[.F50]*[.$B$1] -> 0 | H50: of:=[.G50]+[.F50] -> 42000
A51: of:=[.A50]+1 -> 2066 | B51: of:=[.B50]+1 -> 92 | C51: of:=[.C50]+1 -> 42 | D51: of:=[.H50] -> 42000 | E51: of:=[.E50]*(1+[.$B$3]) -> 1000 | F51: of:=[.E51]+[.D51] -> 43000 | G51: of:=[.F51]*[.$B$1] -> 0 | H51: of:=[.G51]+[.F51] -> 43000
A52: of:=[.A51]+1 -> 2067 | B52: of:=[.B51]+1 -> 93 | C52: of:=[.C51]+1 -> 43 | D52: of:=[.H51] -> 43000 | E52: of:=[.E51]*(1+[.$B$3]) -> 1000 | F52: of:=[.E52]+[.D52] -> 44000 | G52: of:=[.F52]*[.$B$1] -> 0 | H52: of:=[.G52]+[.F52] -> 44000
A53: of:=[.A52]+1 -> 2068 | B53: of:=[.B52]+1 -> 94 | C53: of:=[.C52]+1 -> 44 | D53: of:=[.H52] -> 44000 | E53: of:=[.E52]*(1+[.$B$3]) -> 1000 | F53: of:=[.E53]+[.D53] -> 45000 | G53: of:=[.F53]*[.$B$1] -> 0 | H53: of:=[.G53]+[.F53] -> 45000